{
  "allocation_trace": [
    {
      "candidates": [
        "C01",
        "C02",
        "C04",
        "C05"
      ],
      "chosen": "C04",
      "random_index": 2,
      "remaining_capacity_after": {
        "C01": 2,
        "C02": 2,
        "C03": 2,
        "C04": 1,
        "C05": 2
      },
      "role_id": "T01",
      "step": 1
    },
    {
      "candidates": [
        "C01",
        "C03"
      ],
      "chosen": "C01",
      "random_index": 0,
      "remaining_capacity_after": {
        "C01": 1,
        "C02": 2,
        "C03": 2,
        "C04": 1,
        "C05": 2
      },
      "role_id": "T02",
      "step": 2
    },
    {
      "candidates": [
        "C02",
        "C04"
      ],
      "chosen": "C02",
      "random_index": 0,
      "remaining_capacity_after": {
        "C01": 1,
        "C02": 1,
        "C03": 2,
        "C04": 1,
        "C05": 2
      },
      "role_id": "T03",
      "step": 3
    },
    {
      "candidates": [
        "C01",
        "C02",
        "C04",
        "C05"
      ],
      "chosen": "C01",
      "random_index": 0,
      "remaining_capacity_after": {
        "C01": 0,
        "C02": 1,
        "C03": 2,
        "C04": 1,
        "C05": 2
      },
      "role_id": "T04",
      "step": 4
    },
    {
      "candidates": [
        "C03"
      ],
      "chosen": "C03",
      "random_index": 0,
      "remaining_capacity_after": {
        "C01": 0,
        "C02": 1,
        "C03": 1,
        "C04": 1,
        "C05": 2
      },
      "role_id": "T05",
      "step": 5
    },
    {
      "candidates": [
        "C02",
        "C03",
        "C05"
      ],
      "chosen": "C02",
      "random_index": 0,
      "remaining_capacity_after": {
        "C01": 0,
        "C02": 0,
        "C03": 1,
        "C04": 1,
        "C05": 2
      },
      "role_id": "T06",
      "step": 6
    },
    {
      "candidates": [
        "C04"
      ],
      "chosen": "C04",
      "random_index": 0,
      "remaining_capacity_after": {
        "C01": 0,
        "C02": 0,
        "C03": 1,
        "C04": 0,
        "C05": 2
      },
      "role_id": "T07",
      "step": 7
    },
    {
      "candidates": [
        "C05"
      ],
      "chosen": "C05",
      "random_index": 0,
      "remaining_capacity_after": {
        "C01": 0,
        "C02": 0,
        "C03": 1,
        "C04": 0,
        "C05": 1
      },
      "role_id": "T08",
      "step": 8
    },
    {
      "candidates": [
        "C05"
      ],
      "chosen": "C05",
      "random_index": 0,
      "remaining_capacity_after": {
        "C01": 0,
        "C02": 0,
        "C03": 1,
        "C04": 0,
        "C05": 0
      },
      "role_id": "T09",
      "step": 9
    },
    {
      "candidates": [
        "C03"
      ],
      "chosen": "C03",
      "random_index": 0,
      "remaining_capacity_after": {
        "C01": 0,
        "C02": 0,
        "C03": 0,
        "C04": 0,
        "C05": 0
      },
      "role_id": "T10",
      "step": 10
    }
  ],
  "assignment": {
    "T01": "C04",
    "T02": "C01",
    "T03": "C02",
    "T04": "C01",
    "T05": "C03",
    "T06": "C02",
    "T07": "C04",
    "T08": "C05",
    "T09": "C05",
    "T10": "C03"
  },
  "filter_trace": [
    {
      "matched_rules": [
        "R001",
        "R002",
        "R003"
      ],
      "qualified": true,
      "role_id": "T01",
      "target_id": "C01"
    },
    {
      "matched_rules": [
        "R001",
        "R002",
        "R003"
      ],
      "qualified": true,
      "role_id": "T01",
      "target_id": "C02"
    },
    {
      "failed_rule": "R001",
      "matched_rules": [
        "R002",
        "R003"
      ],
      "qualified": false,
      "role_id": "T01",
      "target_id": "C03"
    },
    {
      "matched_rules": [
        "R001",
        "R002",
        "R003"
      ],
      "qualified": true,
      "role_id": "T01",
      "target_id": "C04"
    },
    {
      "matched_rules": [
        "R001",
        "R002",
        "R003"
      ],
      "qualified": true,
      "role_id": "T01",
      "target_id": "C05"
    },
    {
      "matched_rules": [
        "R001",
        "R002",
        "R003"
      ],
      "qualified": true,
      "role_id": "T02",
      "target_id": "C01"
    },
    {
      "failed_rule": "R001",
      "matched_rules": [
        "R002",
        "R003"
      ],
      "qualified": false,
      "role_id": "T02",
      "target_id": "C02"
    },
    {
      "matched_rules": [
        "R001",
        "R002",
        "R003"
      ],
      "qualified": true,
      "role_id": "T02",
      "target_id": "C03"
    },
    {
      "failed_rule": "R001",
      "matched_rules": [
        "R002",
        "R003"
      ],
      "qualified": false,
      "role_id": "T02",
      "target_id": "C04"
    },
    {
      "failed_rule": "R001",
      "matched_rules": [
        "R002",
        "R003"
      ],
      "qualified": false,
      "role_id": "T02",
      "target_id": "C05"
    },
    {
      "failed_rule": "R001",
      "matched_rules": [
        "R002",
        "R003"
      ],
      "qualified": false,
      "role_id": "T03",
      "target_id": "C01"
    },
    {
      "matched_rules": [
        "R001",
        "R002",
        "R003"
      ],
      "qualified": true,
      "role_id": "T03",
      "target_id": "C02"
    },
    {
      "failed_rule": "R001",
      "matched_rules": [
        "R002",
        "R003"
      ],
      "qualified": false,
      "role_id": "T03",
      "target_id": "C03"
    },
    {
      "matched_rules": [
        "R001",
        "R002",
        "R003"
      ],
      "qualified": true,
      "role_id": "T03",
      "target_id": "C04"
    },
    {
      "failed_rule": "R001",
      "matched_rules": [
        "R002",
        "R003"
      ],
      "qualified": false,
      "role_id": "T03",
      "target_id": "C05"
    },
    {
      "matched_rules": [
        "R001",
        "R002",
        "R003"
      ],
      "qualified": true,
      "role_id": "T04",
      "target_id": "C01"
    },
    {
      "matched_rules": [
        "R001",
        "R002",
        "R003"
      ],
      "qualified": true,
      "role_id": "T04",
      "target_id": "C02"
    },
    {
      "failed_rule": "R001",
      "matched_rules": [
        "R002",
        "R003"
      ],
      "qualified": false,
      "role_id": "T04",
      "target_id": "C03"
    },
    {
      "matched_rules": [
        "R001",
        "R002",
        "R003"
      ],
      "qualified": true,
      "role_id": "T04",
      "target_id": "C04"
    },
    {
      "matched_rules": [
        "R001",
        "R002",
        "R003"
      ],
      "qualified": true,
      "role_id": "T04",
      "target_id": "C05"
    },
    {
      "matched_rules": [
        "R001",
        "R002",
        "R003"
      ],
      "qualified": true,
      "role_id": "T05",
      "target_id": "C01"
    },
    {
      "failed_rule": "R001",
      "matched_rules": [
        "R002",
        "R003"
      ],
      "qualified": false,
      "role_id": "T05",
      "target_id": "C02"
    },
    {
      "matched_rules": [
        "R001",
        "R002",
        "R003"
      ],
      "qualified": true,
      "role_id": "T05",
      "target_id": "C03"
    },
    {
      "failed_rule": "R001",
      "matched_rules": [
        "R002",
        "R003"
      ],
      "qualified": false,
      "role_id": "T05",
      "target_id": "C04"
    },
    {
      "failed_rule": "R001",
      "matched_rules": [
        "R002",
        "R003"
      ],
      "qualified": false,
      "role_id": "T05",
      "target_id": "C05"
    },
    {
      "failed_rule": "R001",
      "matched_rules": [
        "R002",
        "R003"
      ],
      "qualified": false,
      "role_id": "T06",
      "target_id": "C01"
    },
    {
      "matched_rules": [
        "R001",
        "R002",
        "R003"
      ],
      "qualified": true,
      "role_id": "T06",
      "target_id": "C02"
    },
    {
      "matched_rules": [
        "R001",
        "R002",
        "R003"
      ],
      "qualified": true,
      "role_id": "T06",
      "target_id": "C03"
    },
    {
      "failed_rule": "R001",
      "matched_rules": [
        "R002",
        "R003"
      ],
      "qualified": false,
      "role_id": "T06",
      "target_id": "C04"
    },
    {
      "matched_rules": [
        "R001",
        "R002",
        "R003"
      ],
      "qualified": true,
      "role_id": "T06",
      "target_id": "C05"
    },
    {
      "failed_rule": "R001",
      "matched_rules": [
        "R002",
        "R003"
      ],
      "qualified": false,
      "role_id": "T07",
      "target_id": "C01"
    },
    {
      "matched_rules": [
        "R001",
        "R002",
        "R003"
      ],
      "qualified": true,
      "role_id": "T07",
      "target_id": "C02"
    },
    {
      "failed_rule": "R001",
      "matched_rules": [
        "R002",
        "R003"
      ],
      "qualified": false,
      "role_id": "T07",
      "target_id": "C03"
    },
    {
      "matched_rules": [
        "R001",
        "R002",
        "R003"
      ],
      "qualified": true,
      "role_id": "T07",
      "target_id": "C04"
    },
    {
      "failed_rule": "R001",
      "matched_rules": [
        "R002",
        "R003"
      ],
      "qualified": false,
      "role_id": "T07",
      "target_id": "C05"
    },
    {
      "failed_rule": "R001",
      "matched_rules": [
        "R002",
        "R003"
      ],
      "qualified": false,
      "role_id": "T08",
      "target_id": "C01"
    },
    {
      "failed_rule": "R001",
      "matched_rules": [
        "R002",
        "R003"
      ],
      "qualified": false,
      "role_id": "T08",
      "target_id": "C02"
    },
    {
      "failed_rule": "R001",
      "matched_rules": [
        "R002",
        "R003"
      ],
      "qualified": false,
      "role_id": "T08",
      "target_id": "C03"
    },
    {
      "failed_rule": "R001",
      "matched_rules": [
        "R002",
        "R003"
      ],
      "qualified": false,